{
  "api-version": "tesseraft.fragment/v1",
  "kind": "fragment",
  "metadata": {"name": "fragment-parity-fixture"},
  "interface": {
    "inputs": {"repo-root": {"type": "string", "required": true}},
    "outputs": {"status": {"schema": "schemas/status.schema.json", "required": true}},
    "outcomes": ["pass", "fail"]
  },
  "requirements": {
    "executors": ["pi-cli"],
    "handlers": ["noop/succeed"],
    "tools": ["read", "bash"],
    "resources": {"requires": [{"kind": "input", "name": "repo-root", "mode": "reusable"}]}
  },
  "assets": {"schemas": ["schemas/status.schema.json"]},
  "fragment": {
    "initial": "lint",
    "entry": {"inputs": ["repo-root"]},
    "exit": [
      {"on": "pass", "produces": {"status": "status/pass.json"}},
      {"on": "fail", "produces": {"status": "status/fail.json"}}
    ],
    "states": {
      "lint": {
        "type": "deterministic",
        "handler": "noop/succeed",
        "runtime": {"timeout": "1m"},
        "outputs": {"status": {"path": "lint/status.json", "required": true}},
        "transitions": [
          {"when": {"status": "pass"}, "next": "done"},
          {"when": {"status": "fail"}, "effects": ["inc-round"], "next": "failed"}
        ]
      },
      "done": {"type": "terminal", "status": "success", "outcome": "pass"},
      "failed": {"type": "terminal", "status": "failure", "outcome": "fail"}
    }
  }
}
