{
  "api-version": "tesseraft.fragment/v1",
  "kind": "fragment",
  "metadata": {"name": "fragment-parity-fixture"},
  "interface": {
    "inputs": {"repo-root": {"type": "string", "required": true}},
    "outputs": {"status": {"schema": "schemas/status.schema.json", "required": true}},
    "outcomes": ["pass", "fail"]
  },
  "requirements": {
    "executors": ["pi-cli"],
    "handlers": ["noop/succeed"],
    "tools": ["read", "bash"],
    "resources": {"requires": [{"kind": "input", "name": "repo-root", "mode": "reusable"}]}
  },
  "assets": {"prompts": ["prompts/fix.md.tmpl", "prompts/fix-feedback.md.tmpl"], "schemas": ["schemas/status.schema.json"]},
  "fragment": {
    "initial": "lint",
    "policies": {"allowed-agent-tools": ["custom/review"]},
    "entry": {"inputs": ["repo-root"]},
    "exit": [
      {"on": "pass", "produces": {"status": "status/pass.json"}},
      {"on": "fail", "produces": {"status": "status/fail.json"}}
    ],
    "states": {
      "lint": {
        "type": "agent",
        "executor": "pi-cli",
        "tools": ["custom/review"],
        "prompt-template": "prompts/fix.md.tmpl",
        "session": {
          "mode": "resumable",
          "continuation-prompt-template": "prompts/fix-feedback.md.tmpl",
          "continuation-prompt-output": "prompts/generated/fix-feedback-{{run.attempt}}.md"
        },
        "runtime": {"timeout": "1m"},
        "outputs": {"status": {"path": "lint/status-{{run.attempt}}.json", "required": true}},
        "transitions": [
          {"when": {"status": "pass"}, "next": "done"},
          {"when": {"status": "fail"}, "effects": ["inc-round"], "next": "failed"}
        ]
      },
      "done": {"type": "terminal", "status": "success", "outcome": "pass"},
      "failed": {"type": "terminal", "status": "failure", "outcome": "fail"}
    }
  }
}
